output/tables/weed_biomass/interrow_site_year_treatment_model_means.csv

treatment,site_year,response,SE,df,asymp.LCL,asymp.UCL
RNO,V_2023,356.69837792041756,182.8941981480095,Inf,130.57332153196182,974.4236519242767
RIM,V_2023,131.744458137706,76.05587993134289,Inf,42.49471974804252,408.44138643360003
RIC,V_2023,286.00491319079646,146.9863837057417,Inf,104.45178010945004,783.1250964182894
TIM,V_2023,503.1661906139975,237.7458996328167,Inf,199.30533992495538,1270.2931866869717
TIC,V_2023,3.2128428531260567,3.4937007648646983,Inf,0.3813100359614576,27.070777649100616
RNO,O2E_2024,105.41183704465944,70.31123277160646,Inf,28.518425050424966,389.6307516801055
RIM,O2E_2024,24.112914717002266,18.442280072685115,Inf,5.385490338893508,107.9628073882841
RIC,O2E_2024,1.6890962055404397,2.018643903339666,Inf,0.16232330931435374,17.576317311557087
TIM,O2E_2024,120.30091909891983,72.17370432258234,Inf,37.11901704341026,389.8893960235978
TIC,O2E_2024,25.433390262574047,20.698101173825552,Inf,5.1603930139666705,125.35040228480048
RNO,O2W_2024,186.96351123795594,115.19591683055891,Inf,55.88516527980485,625.4853924008532
RIM,O2W_2024,19.84734428159123,16.09417269749987,Inf,4.05009056834596,97.2613003054118
RIC,O2W_2024,186.03666530851564,112.4586845659821,Inf,56.8917650442858,608.3418366818426
TIM,O2W_2024,156.94533221638977,89.78056815365134,Inf,51.14681686400984,481.5908166876654
TIC,O2W_2024,0.4239476479365474,0.6394774483599205,Inf,0.02204805229703074,8.151813401455675

analysis/weed_biomass-1-.md

## site_year = V_2023:

##  treatment response      SE  df asymp.LCL asymp.UCL
    ##  RNO        356.698 183.000 Inf   130.573    974.42
    ##  RIM        131.744  76.100 Inf    42.495    408.44
    ##  RIC        286.005 147.000 Inf   104.452    783.13
    ##  TIM        503.166 238.000 Inf   199.305   1270.29
    ##  TIC          3.213   3.490 Inf     0.381     27.07
    ## 
    ## site_year = O2E_2024:
    ##  treatment response      SE  df asymp.LCL asymp.UCL
    ##  RNO        105.412  70.300 Inf    28.518    389.63
    ##  RIM         24.113  18.400 Inf     5.385    107.96
    ##  RIC          1.689   2.020 Inf     0.162     17.58
    ##  TIM        120.301  72.200 Inf    37.119    389.89
    ##  TIC         25.433  20.700 Inf     5.160    125.35
    ## 
    ## site_year = O2W_2024:
    ##  treatment response      SE  df asymp.LCL asymp.UCL
    ##  RNO        186.964 115.000 Inf    55.885    625.49
    ##  RIM         19.847  16.100 Inf     4.050     97.26
    ##  RIC        186.037 112.000 Inf    56.892    608.34
    ##  TIM        156.945  89.800 Inf    51.147    481.59
    ##  TIC          0.424   0.639 Inf     0.022      8.15
    ## 
    ## Confidence level used: 0.95 
    ## Intervals are back-transformed from the log scale